{
  "$schema": "https://json-schema.org/draft/2020-12/schema",
  "$id": "https://openship.dev/schemas/discovery.schema.json",
  "title": "OpenShip v1 discovery",
  "type": "object",
  "required": ["openship", "capability", "project", "capabilities"],
  "properties": {
    "openship": { "const": "1.0" },
    "capability": { "const": "discovery" },
    "project": {
      "type": "object",
      "required": ["name", "description"],
      "properties": {
        "name": { "type": "string", "minLength": 1 },
        "description": { "type": "string", "minLength": 1 }
      },
      "additionalProperties": true
    },
    "skill": { "$ref": "#/$defs/httpsUrl" },
    "capabilities": {
      "type": "object",
      "required": ["sources"],
      "properties": {
        "sources": {
          "type": "object",
          "required": ["manifest", "bundle"],
          "properties": {
            "manifest": { "$ref": "#/$defs/httpsUrl" },
            "bundle": { "$ref": "#/$defs/httpsUrl" },
            "file": { "type": "string", "pattern": "^https://.+\\{path\\}.+$|^https://.+/\\{path\\}$" },
            "archive": { "$ref": "#/$defs/httpsUrl" },
            "instructions": { "$ref": "#/$defs/httpsUrl" }
          },
          "additionalProperties": true
        },
        "changes": {
          "type": "object",
          "required": ["policy", "submit", "status"],
          "properties": {
            "policy": { "$ref": "#/$defs/httpsUrl" },
            "submit": { "$ref": "#/$defs/httpsUrl" },
            "status": { "type": "string", "pattern": "^https://.+\\{changeId\\}.+$|^https://.+/\\{changeId\\}$" }
          },
          "additionalProperties": true
        },
        "systems": {
          "type": "object",
          "required": ["document"],
          "properties": { "document": { "$ref": "#/$defs/httpsUrl" } },
          "additionalProperties": true
        }
      },
      "additionalProperties": true
    }
  },
  "$defs": {
    "httpsUrl": { "type": "string", "format": "uri", "pattern": "^https://" }
  },
  "additionalProperties": true
}

